{
  "contract_version": "1.0",
  "state": "DISPATCHED",
  "artifacts": {
    "hardening": {"ref": "planning/hardening.md", "sha256": "aaaaaaaaaaaaaaaaaaaaaaaaaaaaaaaaaaaaaaaaaaaaaaaaaaaaaaaaaaaaaaaa"},
    "spec": {"ref": "planning/spec.md", "sha256": "bbbbbbbbbbbbbbbbbbbbbbbbbbbbbbbbbbbbbbbbbbbbbbbbbbbbbbbbbbbbbbbb"},
    "task_graph": {"ref": "planning/tasks.json", "sha256": "cccccccccccccccccccccccccccccccccccccccccccccccccccccccccccccccc"}
  },
  "route": "orchestrated",
  "execution_requested": true,
  "planned_task_owned_writes": true,
  "capability_proof": {"collaboration_available": true, "spawn_api": "collaboration.spawn_agent", "checked_at": "2026-08-20T12:00:00Z"},
  "budget": {"max_agents": 3, "active_count": 2},
  "assignments": [
    {"assignment_id": "assign-exec", "kind": "executor", "task_id": "TASK-1", "dependencies": [], "wave": 1, "role": "governance", "model": "gpt-5.6-terra", "effort": "medium", "fork": "none", "agent_id": "agent-exec", "call_id": "call-exec", "read_scopes": ["core/"], "write_scopes": ["core/control-plane/new-contract.md"], "proof": "tests/new-contract.sh", "reviewer_assignment_id": "assign-review", "recursion": {"delegation_allowed": false, "authorization": null}, "parent_assignment_id": null, "delegation_reference": null},
    {"assignment_id": "assign-review", "kind": "reviewer", "task_id": "TASK-1-review", "dependencies": ["TASK-1"], "wave": 2, "role": "qa-regression", "model": "gpt-5.6-terra", "effort": "medium", "fork": "none", "agent_id": "agent-review", "call_id": "call-review", "read_scopes": ["core/control-plane/new-contract.md", "tests/new-contract.sh"], "write_scopes": [], "proof": "tests/new-contract.sh", "reviewer_assignment_id": null, "recursion": {"delegation_allowed": false, "authorization": null}, "parent_assignment_id": null, "delegation_reference": null}
  ],
  "fan_in": {"owner": "root", "assignment_ids": ["assign-exec", "assign-review"]},
  "exceptions": [],
  "root_write_lock": {"mode": "orchestrated-dispatched-scope-lock", "task_owned_writes_forbidden": true, "dispatched_task_scopes": ["core/control-plane/new-contract.md"]}
}
